{
  "source_id": "src-celik-faz2-dedup-20260621",
  "name": "CELIK Faz 2 dedup corpus",
  "source_type": "other",
  "content_purpose": "pretrain",
  "language": "tr",
  "language_confidence": 0.98,
  "script": "latin",
  "domain": "mixed_clean",
  "genre": "pretraining_corpus",
  "license": "internal_review_required",
  "rights_status": "research_only",
  "source_url": "",
  "license_evidence_ref": "C:\\CELIK-GARDASH\\docs\\FAZ2_CORPUS_HANDOFF_TO_TOKENIZER.md",
  "lineage_ref": "C:\\CELIK-GARDASH\\datasets\\faz2_corpus\\gardash_tr_dedup.jsonl",
  "usage_permission": "pretraining_allowed",
  "redistribution_allowed": false,
  "raw_path": "C:\\CELIK-GARDASH\\datasets\\faz2_corpus\\gardash_tr_dedup.jsonl",
  "original_path": "C:\\CELIK-GARDASH\\datasets\\faz2_corpus\\gardash_tr_dedup.jsonl",
  "immutable_object_uri": "sha256/38/b812046831c9176f217bfae364093cb55c768da3081110e0c062825c6f8a07",
  "immutable_object_sha256": "38b812046831c9176f217bfae364093cb55c768da3081110e0c062825c6f8a07",
  "normalized_path": "C:\\CELIK-GARDASH\\datasets\\faz2_corpus\\gardash_tr_dedup.lf.txt",
  "approved_path": "C:\\CELIK-GARDASH\\datasets\\faz2_corpus\\gardash_tr_dedup.lf.txt",
  "sha256": "38b812046831c9176f217bfae364093cb55c768da3081110e0c062825c6f8a07",
  "raw_bytes": 13560000000,
  "line_count": 6027968,
  "document_count": 6027968,
  "risk_level": "unknown",
  "pii_risk": "unknown",
  "pii_status": "not_scanned",
  "copyright_risk": "unknown",
  "sensitive_domain": false,
  "quality_score": 0.75,
  "dedup": {
    "group": "faz2_cross_source",
    "method": "exact_whitespace_normalized",
    "exact_done": true,
    "near_done": false,
    "report_path": "C:\\CELIK-GARDASH\\docs\\FAZ2_CORPUS_FINDINGS.md"
  },
  "status": "frozen_release",
  "approval_status": "frozen",
  "split": "train",
  "train_allowed": true,
  "eval_allowed": false,
  "tokenizer_allowed": true,
  "reviewer": "llm_team",
  "review_notes": "Imported as the existing immutable v3.8/Faz 2 release seed.",
  "created_by": "llm_team",
  "created_at": "2026-06-21T00:00:00Z",
  "updated_at": "2026-06-22T00:00:00Z"
}
